{"analysis_scope_digest":"7b47e00a7c7544149d5957ff918c13b3efb115665cac71774408157ecd00d8d1","artifact_kind":"FACT_SET","canonicalization_profile":"veritrail-json-c14n/1","conflicts":[],"derivation_profile_digest":"e8bbe54140ff2a082b69d6b6967d8630a423abd135ac6e7be0badc1fe053125b","fact_set_digest":"a1caf8e57c7362649cdbe4c18a857e470bf930f4c6e07b47c95b0cf4af53e45a","facts":[{"derivation_profile_digest":"e8bbe54140ff2a082b69d6b6967d8630a423abd135ac6e7be0badc1fe053125b","fact_id":"7a00cb5656f706ad97b236ed0cf239dbac84400d1845d557fb4444f7c12069f8","fact_kind":"IMPORT_DECLARATION","local_ordinal":0,"provenance_refs":["56178c8b176896f6727cec8f942a7d5063caed4e422b6b34325b3b03a6dfde00"],"semantic_attributes":{"alias_name":null,"import_form":"IMPORT","imported_name":null,"module_parts":["pkg","mod"],"relative_level":0},"source_anchor":{"end_byte":14,"git_path":{"git_path_hex":"706b672f6d6f642e7079","path_kind":"GIT_PATH"},"start_byte":0},"source_snapshot_digest":"3acb02f99805fd684ff68a1e0d2a2e24a22d75232564a1f52646c89e4398f747","subject_key_digest":"e33dc0d5de5437168c3dfdd548fdab99e319116701b490afc5a50e1b193e7581","subject_space":"IMPORT_ALIAS"},{"derivation_profile_digest":"e8bbe54140ff2a082b69d6b6967d8630a423abd135ac6e7be0badc1fe053125b","fact_id":"ffbec0037c18189f6d6af2e28ababcbed60b61a299ce58d1e0ca3f1cbcf15bf7","fact_kind":"MODULE","local_ordinal":0,"provenance_refs":["56178c8b176896f6727cec8f942a7d5063caed4e422b6b34325b3b03a6dfde00"],"semantic_attributes":{"module_key_parts":["pkg","mod"]},"source_anchor":{"end_byte":15,"git_path":{"git_path_hex":"706b672f6d6f642e7079","path_kind":"GIT_PATH"},"start_byte":0},"source_snapshot_digest":"3acb02f99805fd684ff68a1e0d2a2e24a22d75232564a1f52646c89e4398f747","subject_key_digest":"e95ac31856ede36bf0642811cce8fe3ba16fe1f4ca22f96e705090b9bee76ed9","subject_space":"MODULE_ENTITY"}],"policy_digest":"ba5d50b166e56a5d8ee3fd8fd56841e8008dd43196c1547840810eb3e6209c4a","schema_version":"0.1","source_snapshot_digest":"3acb02f99805fd684ff68a1e0d2a2e24a22d75232564a1f52646c89e4398f747"}
